{
  "$schema": "https://json-schema.org/draft/2020-12/schema",
  "$id": "https://registryops.org/schemas/proof_attestation.schema.json",
  "title": "RegistryOps Evolving Proof Attestation Revision",
  "type": "object",
  "additionalProperties": false,
  "required": [
    "contract_profile",
    "publication_id",
    "revision_id",
    "created_at",
    "status",
    "snapshot_merkle_root_sha256",
    "snapshot_events_sha256",
    "anchor_ots_path",
    "anchor_ots_sha256",
    "previous_revision_manifest_sha256",
    "last_verified_at",
    "verification_method",
    "verification_target",
    "verification_result",
    "details"
  ],
  "properties": {
    "contract_profile": {
      "const": "registryops-contract-2026-07"
    },
    "publication_id": {
      "type": "string",
      "pattern": "^phase[12]-[0-9]{6}$"
    },
    "revision_id": {
      "type": "string",
      "pattern": "^r[0-9]{6}$"
    },
    "created_at": {
      "type": "string",
      "pattern": "^\\d{4}-\\d{2}-\\d{2}T\\d{2}:\\d{2}:\\d{2}Z$"
    },
    "status": {
      "type": "string",
      "enum": [
        "ots_present_unverified",
        "verified"
      ]
    },
    "snapshot_merkle_root_sha256": {
      "type": "string",
      "pattern": "^[a-f0-9]{64}$"
    },
    "snapshot_events_sha256": {
      "type": "string",
      "pattern": "^[a-f0-9]{64}$"
    },
    "anchor_ots_path": {
      "const": "anchor.ots"
    },
    "anchor_ots_sha256": {
      "type": "string",
      "pattern": "^[a-f0-9]{64}$"
    },
    "previous_revision_manifest_sha256": {
      "type": [
        "string",
        "null"
      ],
      "pattern": "^[a-f0-9]{64}$"
    },
    "last_verified_at": {
      "type": [
        "string",
        "null"
      ],
      "pattern": "^\\d{4}-\\d{2}-\\d{2}T\\d{2}:\\d{2}:\\d{2}Z$"
    },
    "verification_method": {
      "type": [
        "string",
        "null"
      ],
      "maxLength": 200
    },
    "verification_target": {
      "type": [
        "string",
        "null"
      ],
      "enum": [
        "bitcoin",
        null
      ]
    },
    "verification_result": {
      "type": [
        "string",
        "null"
      ],
      "enum": [
        "published_anchor_verified",
        null
      ]
    },
    "details": {
      "type": "string",
      "minLength": 1,
      "maxLength": 500
    }
  },
  "allOf": [
    {
      "if": {
        "properties": {
          "status": {
            "const": "verified"
          }
        }
      },
      "then": {
        "properties": {
          "last_verified_at": {
            "type": "string"
          },
          "verification_method": {
            "type": "string",
            "minLength": 1
          },
          "verification_target": {
            "const": "bitcoin"
          },
          "verification_result": {
            "const": "published_anchor_verified"
          }
        }
      }
    }
  ]
}
