{
  "anchor_ots_path": "anchor.ots",
  "anchor_ots_sha256": "b9c60e2b4c367f7a4a8cea87dde555722775d4b4b7c7b6dddfd927377ca3a0bb",
  "contract_profile": "registryops-contract-2026-07",
  "created_at": "2026-08-23T07:08:37Z",
  "details": "OTS proof revision is available; external Bitcoin verification remains pending.",
  "last_verified_at": null,
  "previous_revision_manifest_sha256": null,
  "publication_id": "phase2-000161",
  "revision_id": "r000001",
  "snapshot_events_sha256": "7e60bf282d50ac54bebd4c243e5b89d12599c4dea10af63c954f5cf7c0e364b7",
  "snapshot_merkle_root_sha256": "25f5971eb4b5fbca9898311c2be91115adfd799f23bc9ff89f865078871d98df",
  "status": "ots_present_unverified",
  "verification_method": null,
  "verification_result": null,
  "verification_target": null
}
