{
  "anchor_ots_path": "anchor.ots",
  "anchor_ots_sha256": "80f1d0b2aeeb354660f0a87fe9ae0e7330e54f04a67873e6d0c8ce8610c25c09",
  "contract_profile": "registryops-contract-2026-07",
  "created_at": "2026-10-23T18:28:16Z",
  "details": "OTS proof revision is available; external Bitcoin verification remains pending.",
  "last_verified_at": null,
  "previous_revision_manifest_sha256": null,
  "publication_id": "phase2-000245",
  "revision_id": "r000001",
  "snapshot_events_sha256": "ba5942ba2cdc7151aaadc1656c022593462798576398bbb1194eb5ebddbbe8a9",
  "snapshot_merkle_root_sha256": "edd3b0775cca6d3d4106c5b972443e43d47d8fcd92802efb5f4df28b88983c6e",
  "status": "ots_present_unverified",
  "verification_method": null,
  "verification_result": null,
  "verification_target": null
}
