{
  "anchor_ots_path": "anchor.ots",
  "anchor_ots_sha256": "2bef4e76bc616659ba255837c092d6ee53401ff00fd089de3541d3750fb49de7",
  "contract_profile": "registryops-contract-2026-07",
  "created_at": "2026-07-26T08:43:11Z",
  "details": "OTS proof revision is available; external Bitcoin verification remains pending.",
  "last_verified_at": null,
  "previous_revision_manifest_sha256": null,
  "publication_id": "phase2-000117",
  "revision_id": "r000001",
  "snapshot_events_sha256": "dad0b6ffbe3296c73be0c423ed57e4967f9e313d5b8ffac067573159f05bfd91",
  "snapshot_merkle_root_sha256": "f31273d21f7ca1244f0fcf45581128e18830537bc0266e3898e58966950f266e",
  "status": "ots_present_unverified",
  "verification_method": null,
  "verification_result": null,
  "verification_target": null
}
