{
  "anchor_ots_path": "anchor.ots",
  "anchor_ots_sha256": "790f666b1d1af94ec9dfb92e2d0709a14ecbab7f3434dcc4d3473d23286f424d",
  "contract_profile": "registryops-contract-2026-07",
  "created_at": "2026-09-26T21:20:15Z",
  "details": "OTS proof revision is available; external Bitcoin verification remains pending.",
  "last_verified_at": null,
  "previous_revision_manifest_sha256": null,
  "publication_id": "phase2-000212",
  "revision_id": "r000001",
  "snapshot_events_sha256": "738b5095045a4dc62171fcbfbcbd6da758a3bfbeda15ab1e83b292cef675da0f",
  "snapshot_merkle_root_sha256": "4108c73ec12f18a0bcba97c971de78afb6e768f1420e6bca271ba9ff96b8c458",
  "status": "ots_present_unverified",
  "verification_method": null,
  "verification_result": null,
  "verification_target": null
}
