{
  "anchor_ots_path": "anchor.ots",
  "anchor_ots_sha256": "0d0e6ac733f803bdc7b453d9d1ddbe59fe8a981d14f64cac43c414193fa9004a",
  "contract_profile": "registryops-contract-2026-07",
  "created_at": "2026-09-23T21:38:04Z",
  "details": "OTS proof revision is available; external Bitcoin verification remains pending.",
  "last_verified_at": null,
  "previous_revision_manifest_sha256": null,
  "publication_id": "phase2-000204",
  "revision_id": "r000001",
  "snapshot_events_sha256": "a3cbf84bf3e9c6668aca25f2933e4d9e6c06142401309dd9891f94c6823d513a",
  "snapshot_merkle_root_sha256": "2aafbef1ca22c701349497ce83d4883c8a09e712e75019824da2f2e26216efa9",
  "status": "ots_present_unverified",
  "verification_method": null,
  "verification_result": null,
  "verification_target": null
}
