{
  "anchor_ots_path": "anchor.ots",
  "anchor_ots_sha256": "d8720749bf028b009af39222a7ac02db24fc751cca988b8fe45270fe99d86667",
  "contract_profile": "registryops-contract-2026-07",
  "created_at": "2026-08-26T20:18:45Z",
  "details": "OTS proof revision is available; external Bitcoin verification remains pending.",
  "last_verified_at": null,
  "previous_revision_manifest_sha256": null,
  "publication_id": "phase2-000166",
  "revision_id": "r000001",
  "snapshot_events_sha256": "af5ef922afd4429733496564fc128b9915aa98e5851e3124622adbc179202296",
  "snapshot_merkle_root_sha256": "dc5fa8c1ba0f03372f17484d33f89c87fa5c13989be35b574bbac578ee7fa9b1",
  "status": "ots_present_unverified",
  "verification_method": null,
  "verification_result": null,
  "verification_target": null
}
